user_id,author_id,author,title,year,abstract,co_author,coauthor_id
26,1025,Rudolf Fleischer,Approximate motion planning and the complexity of the boundary of the union of simple geometric figures,1990,"We study rigid motions of a rectangle amidst polygonal obstacles. The best known algorithms for this problem have running time &OHgr;(n2) where n is the number of obstacle corners. We introduce the tightness of a motion planning problem as a measure of the difficulty of a planning problem in an intuitive sense and describe an algorithm with running time &ogr;((a/b · 1/&egr; crit + 1)n(log n)2), where a ? b are the lengths of the sides of a rectangle and &egr;crit is the tightness of the problem. We show further that the complexity (= number of vertices) of the boundary of n bow-ties (c.f. Figure 1.1) is &Ogr;(n). Similar results for the union of other simple geometric figures such as triangles and wedges are also presented.",Michael Kaufmann,1015
27,1026,Robert L. Brown,Advanced Operating Systems,1984,First Page of the Article,Peter J. Denning,1028
28,1027,Karen A. Frenkel,"Computers, complexity, and the Statue of Liberty restoration",1986,Twentieth-century techniques such as computer-aided engineering and finite-element analysis were used to restore the nineteenth-century monument,Karen A. Frenkel,1027
29,1028,Peter J. Denning,An ACM response: the scope and directions of Computer Science,1991,"The National Research Council's Computer Science and Telecommunications Board (CSTB) chartered a two-year study on the scope and directions of computer science. As part of this study, ACM was asked to provide input on three important questions, the answers to which could have significant impact on the future direction of our discipline and profession.",Barbara Simons,1029
30,1029,Barbara Simons,An ACM response: the scope and directions of Computer Science,1991,"The National Research Council's Computer Science and Telecommunications Board (CSTB) chartered a two-year study on the scope and directions of computer science. As part of this study, ACM was asked to provide input on three important questions, the answers to which could have significant impact on the future direction of our discipline and profession.",A. Joe Turner,1093
31,1028,Peter J. Denning,A conversation with Steve Jobs,1989,"NeXT, Inc. President and CEO Steve Jobs (left), and VP of Sales and Marketing, Dan'l Lewin, discuss the goals of the new company, and the NeXT Computer System itself.",Karen A. Frenkel,1027
32,1028,Peter J. Denning,The evolution of parallel processing,1985,"As everyone knows, the computer industry is passing through a period of great change. I was speaking recently to a senior executive in one of the large companies vigorously working to meet the developing situation. The question he posed was: “Could it have been predicted?”",Peter J. Denning,1028
33,1032,Eli Upfal,How to share memory in a distributed system,1987,"The power of shared-memory in models of parallel computation is studied, and a novel distributed data structure that eliminates the need for shared memory without significantly increasing the run time of the parallel computation is described. More specifically, it is shown how a complete network of processors can deterministically simulate one PRAM step in O(log n/(log log n)2) time when both models use n processors and the size of the PRAM's shared memory is polynomial in n. (The best previously known upper bound was the trivial O(n)). It is established that this upper bound is nearly optimal, and it is proved that an on-line simulation of T PRAM steps by a complete network of processors requires &OHgr;(T(log n/ log log n)) time.A simple consequence of the upper bound is that an Ultracomputer (the currently feasible general-purpose parallel machine) can simulate one step of a PRAM (the most convenient parallel model to program) in O((log n)2log log n) steps.",Avi Wigderson,1038
34,1032,Eli Upfal,A tradeoff between space and efficiency for routing tables,1988,"Two conflicting goals play a crucial role in the design of routing schemes for communication networks. A routing scheme should use as short as possible paths for routing messages in the network, while keeping the routing information stored in the processors' local memory as succinct as possible. The efficiency of a routing scheme is measured in terms of its stretch factor - the maximum ratio between the length of a route computed by the scheme and that of a shortest path connecting the same pair of vertices.Most previous work has concentrated on finding good routing schemes (with a small fixed stretch factor) for special classes of network topologies. In this work we study the problem for general networks, and look at the entire range of possible stretch factors. The results exhibit a tradeoff between the efficiency of a routing scheme and its space requirements. We present almost tight upper and lower bounds for this tradeoff. Specifically, we prove that any routing scheme for general n-vertex networks that achieves a stretch factor k ? 1 must use a total of &OHgr;(n1+1/2k+4) bits of routing information in the networks. This lower bound is complemented by a family H(k) of hierarchical routing schemes (for every fixed k ? 1), which guarantee a stretch factor of &Ogr;(k), require storing a total of &Ogr;(n1+1/k) bits of routing information in the network and name the vertices with &Ogr;(log2 n)-bit names.",David Peleg,1040
35,1034,Manuel Blum,Checking the correctness of memories,1991,"The notion of program checking is extended to include programs that alter their environment, in particular, programs that store and retrieve data from memory. The model considered allows the checker a small amount of reliable memory. The checker is presented with a sequence of requests (online) to a data structure which must reside in a large but unreliable memory. The data structure is viewed as being controlled by an adversary. The checker is to perform each operation in the input sequence using its reliable memory and the unreliable data structure so that any error in the operation of the structure will be detected by the checker with high probability. Checkers for various data structures are presented. Lower bounds of log n on the amount of reliable memory needed by these checkers, where n is the size of the structure, are proved.",Sampath Kannan,1036
36,1035,Abhijit Ghosh,Verification of interacting sequential circuits,1991,"The problem of verifying the equivalence of interacting finite state machines (FSMs) described at the logic level is addressed. The problem is formulated as that of checking for the equivalence of the reset/starting states of the two FSMs. First, separate sum-of-product representations of the ON-sets and OFF-sets of each of the flip-flop inputs and primary outputs of the sequential circuit, are extracted using the PODEM algorithm. We describe a fast algorithm for state differentiation based on this representation. The input as well as the state space is implicitly enumerated through a process of repeated cube intersections to generate the State Transition Graph (STG).In contrast to previous approaches, this algorithm can be efficiently generalized for verifying distributed-style specifications of interacting sequential circuits, exploiting the nature of the interconnection topology. Pipeline latches in a distributed-style specification typically do not add complexity to the sequential behavior of a circuit, but greatly add to the complexity of traditional approaches to verifying sequential circuits. Pipeline latches are easily incorporated into our generalized, hierarchical verification strategy whereby the states of pipeline latches can be implicitly enumerated.Experimental results indicate the superior efficiency of this approach as compared to previous approaches for FSM verification. It is possible to verify examples with more than 1050 states.",Srinivas Devadas,1041
37,1036,Sampath Kannan,Implicit representation of graphs,1988,"How to represent a graph in memory is a fundamental data structuring question. In the usual representations of an n-node graph, the names of the nodes (i.e. integers from 1 to n) betray nothing about the graph itself. Indeed, the names (or labels) on the n nodes are just logn bit place holders to allow data on the edges to code for the structure of the graph. In our scenario, there is no such waste. By assigning &Ogr;(logn) bit labels to the nodes, we completely code for the structure of the graph, so that given the labels of two nodes we can test if they are adjacent in time linear in the size of the labels. Furthermore, given an arbitrary original labeling of the nodes, we can find structure coding labels (as above) that are no more than a small constant factor larger than the original labels. These notions are intimately related to vertex induced universal graphs of polynomial size. For example, we can label planar graphs with structure coding labels of size n. This implies the existence of a graph with n4 nodes that contains all n-node planar graphs as vertex induced subgraphs (It was not previously known that this class had polynomial sized universal graphs). The theorems on finite graphs extend to a theorem about the constrained labeling of infinite graphs.",Moni Naor,1076
38,1037,Manuel Blum,Non-interactive zero-knowledge and its applications,1988,"We show that interaction in any zero-knowledge proof can be replaced by sharing a common, short, random string. We use this result to construct the first public-key cryptosystem secure against chosen ciphertext attack.",Paul Feldman,1043
39,1038,Avi Wigderson,A fast parallel algorithm for the maximal independent set problem,1985,"A parallel algorithm is presented that accepts as input a graph G and produces a maximal independent set of vertices in G. On a P-RAM without the concurrent write or concurrent read features, the algorithm executes in O((log n)4) time and uses O((n/(log n))3) processors, where n is the number of vertices in G. The algorithm has several novel features that may find other applications. These include the use of balanced incomplete block designs to replace random sampling by deterministic sampling, and the use of a “dynamic pigeonhole principle” that generalizes the conventional pigeonhole principle.",Richard M. Karp,1094
40,1032,Eli Upfal,A time-randomness tradeoff for oblivious routing,1988,"Three parameters characterize the performance of a probabilistic algorithm: T, the runtime of the algorithm; Q, the probability that the algorithm fails to complete the computation in the first T steps and R, the amount of randomness used by the algorithm, measured by the entropy of its random source.We present a tight tradeoff between these three parameters for the problem of oblivious packet routing on N-vertex bounded-degree networks. We prove a (1 - Q) log N/T - log Q - &Ogr;(1) lower bound for the entropy of a random source of any oblivious packet routing algorithm that routes an arbitrary permutation in T steps with probability 1 - Q. We show that this lower bound is almost optimal by proving the existence, for every e3 log N ? T ? N1/2, of an oblivious algorithm that terminates in T steps with probability 1 - Q and uses (1-Q+&ogr;(1))logN/T-logQ independent random bits.We complement this result with an explicit construction of a family of oblivious algorithms that use less than a factor of log N more random bits than the optimal algorithm achieving the same run-time.",David Peleg,1040
41,1040,David Peleg,Concurrent dynamic logic,1987,"In this paper concurrent dynamic logic (CDL) is introduced as an extension of dynamic logic tailored toward handling concurrent programs. Properties of CDL are discussed, both on the propositional and first-order level, and the extension is shown to possess most of the desirable properties of DL. Its relationships with the &mgr;-calculus, game logic, DL with recursive procedures, and PTIME are further explored, revealing natural connections between concurrency, recursion, and alternation.",David Peleg,1040
42,1041,Srinivas Devadas,Verification of interacting sequential circuits,1991,"The problem of verifying the equivalence of interacting finite state machines (FSMs) described at the logic level is addressed. The problem is formulated as that of checking for the equivalence of the reset/starting states of the two FSMs. First, separate sum-of-product representations of the ON-sets and OFF-sets of each of the flip-flop inputs and primary outputs of the sequential circuit, are extracted using the PODEM algorithm. We describe a fast algorithm for state differentiation based on this representation. The input as well as the state space is implicitly enumerated through a process of repeated cube intersections to generate the State Transition Graph (STG).In contrast to previous approaches, this algorithm can be efficiently generalized for verifying distributed-style specifications of interacting sequential circuits, exploiting the nature of the interconnection topology. Pipeline latches in a distributed-style specification typically do not add complexity to the sequential behavior of a circuit, but greatly add to the complexity of traditional approaches to verifying sequential circuits. Pipeline latches are easily incorporated into our generalized, hierarchical verification strategy whereby the states of pipeline latches can be implicitly enumerated.Experimental results indicate the superior efficiency of this approach as compared to previous approaches for FSM verification. It is possible to verify examples with more than 1050 states.",David Peleg,1040
43,1042,Abhijit Ghosh,Sequential test generation at the register-transfer and logic levels,1991,"The problem of test generation for non-scan sequential VLSI circuits is addressed. A novel method of test generation that efficiently generates test sequences for stuck-at faults in the logic circuit by exploiting register-transfer-level (RTL) design information is presented. Our approach is targeted at chips with data-path like STG.The problem of sequential test generation is decomposed into three subproblems of combinational test generation, fault-free state justification and fault-free state differentiation. Standard combinational test generation algorithms are used to generate test vectors for stuck-at faults in the logic-level implementation. The required state corresponding to the test vector is justified using a fault-free justification step that is performed using the RTL specification. Similarly, if the effect of the fault has been propagated by the test vector to the flip-flop inputs alone, the faulty state produced is differentiated from the true next state by a differentiation step that uses the RTL specification.New and efficient algorithms for fault-free state justification and differentiation on RTL descriptions that contain arithmetic as well as random logic modules are described. Unlike previous approaches, this approach does not require the storage of covers or a partial STG and can be used to generate tests for entire chips without scan. Exploiting RTL information, together with a new conflict resolution technique results in improvements of up to 100X in performance over sequential test generation techniques restricted to operate at the logic level. We have successfully generated tests for the viterbi speech processor chip [18].",Srinivas Devadas,1041
44,1043,Paul Feldman,Non-interactive zero-knowledge and its applications,1988,"We show that interaction in any zero-knowledge proof can be replaced by sharing a common, short, random string. We use this result to construct the first public-key cryptosystem secure against chosen ciphertext attack.",Paul Feldman,1043
45,1044,Abdul A. Malik,Reduced offsets for two-level multi-valued logic minimization,1991,"The approaches to two-level logic minimization can be classified into two groups: those that use tautology for expansion of cubes and those that use the offset. Tautology based schemes are generally slower and often give somewhat inferior results, because of a limited global picture of the way in which the cube can be expanded. If the offset is used, usually the expansion can be done quickly and in a more global way because it is easier to see effective directions of expansion. The problem with this approach is that there are many functions that have a reasonable size onset and don't care set but the offset is unreasonably large. It was recently shown that for the minimization of such Boolean functions, a new approach using reduced offsets, provides the same global picture and can be computed much faster. In this paper we extend reduced offsets to logic functions with multi-valued inputs.",A. Richard Newton,1046
46,1041,Srinivas Devadas,Verification of interacting sequential circuits,1991,"The problem of verifying the equivalence of interacting finite state machines (FSMs) described at the logic level is addressed. The problem is formulated as that of checking for the equivalence of the reset/starting states of the two FSMs. First, separate sum-of-product representations of the ON-sets and OFF-sets of each of the flip-flop inputs and primary outputs of the sequential circuit, are extracted using the PODEM algorithm. We describe a fast algorithm for state differentiation based on this representation. The input as well as the state space is implicitly enumerated through a process of repeated cube intersections to generate the State Transition Graph (STG).In contrast to previous approaches, this algorithm can be efficiently generalized for verifying distributed-style specifications of interacting sequential circuits, exploiting the nature of the interconnection topology. Pipeline latches in a distributed-style specification typically do not add complexity to the sequential behavior of a circuit, but greatly add to the complexity of traditional approaches to verifying sequential circuits. Pipeline latches are easily incorporated into our generalized, hierarchical verification strategy whereby the states of pipeline latches can be implicitly enumerated.Experimental results indicate the superior efficiency of this approach as compared to previous approaches for FSM verification. It is possible to verify examples with more than 1050 states.",Paul Feldman,1043
47,1046,A. Richard Newton,Proceedings of the 28th ACM/IEEE Design Automation Conference,1991,"The notion of program checking is extended to include programs that alter their environment, in particular, programs that store and retrieve data from memory. The model considered allows the checker a small amount of reliable memory. The checker is presented with a sequence of requests (online) to a data structure which must reside in a large but unreliable memory. The data structure is viewed as being controlled by an adversary. The checker is to perform each operation in the input sequence using its reliable memory and the unreliable data structure so that any error in the operation of the structure will be detected by the checker with high probability. Checkers for various data structures are presented. Lower bounds of log n on the amount of reliable memory needed by these checkers, where n is the size of the structure, are proved.",A. Richard Newton,1046
48,1047,Andrea Casotto,Design management based on design traces,1991,"VOV is an automatic manager for VLSI design. It is based on the idea that CAD tools can leave a “trace” of their execution. The trace is represented as a bipartite directed and acyclic graph, in which the nodes represent either design data or CAD transactions. By managing and analyzing the traces, VOV offers a wide variety of services related to design management, such as coordination of team design, automatic execution of CAD transactions, capture of design history and data dependencies. All of these services are provided in a non-intrusive fashion. VOV has the notion of measurement on the design data, an ingredient which is necessary to provide even more services: tracking of design specifications, validation of design data, design estimation.",A. Richard Newton,1046
49,1048,Kanwar Jit Singh,A heuristic algorithm for the fanout problem,1991,"We present an algorithm to optimally distribute a signal to its required destinations. The choice of the buffers and the topology of the distribution tree depends on the availability of different strength gates and on the load and the required times at the destinations. The general problem is to construct a fanout-tree for a signal so that the required time constraint at the source node is met and the fanout-tree has a minimum area. Since the area constrained fanout problem is NP-complete and area is not a major consideration in present high density designs, we restrict our attention to the simpler problem of designing fast fanout circuits without any area constraint. The proposed algorithm builds the fanout tree by partitioning the fanout signals into subsets and then recursively solving each sub-problem. At each stage the algorithm generates a fanout tree that is an improvement over the previous stage. This feature allows the user to specify the improvement desired by the fanout correction process. The performance of the algorithm, when run on randomly generated distributions of required times and on real design examples, is very promising.",Alberto Sangiovanni-Vincentelli,1049
50,1049,Alberto Sangiovanni-Vincentelli,Computer architecture issues in circuit simulation,1988,"The computational complexity of approximating omega (G), the size of the largest clique in a graph G, within a given factor is considered. It is shown that if certain approximation procedures exist, then EXPTIME=NEXPTIME and NP=P.",Alberto Sangiovanni-Vincentelli,1049
51,1050,J. C. van Vliet,An evaluation of tagging,1985,"Tag handling accounts for a substantial amount of execution cost in latently typed languages such as Common LISP and Scheme, espicially on architectures that provide no special hardware support.",H. M. Gladney,1052
52,1008,Daniel D. Sleator,Amortized efficiency of list update and paging rules,1985,"In this article we study the amortized efficiency of the “move-to-front” and similar rules for dynamically maintaining a linear list. Under the assumption that accessing the ith element from the front of the list takes &thgr;(i) time, we show that move-to-front is within a constant factor of optimum among a wide class of list maintenance rules. Other natural heuristics, such as the transpose and frequency count rules, do not share this property. We generalize our results to show that move-to-front is within a constant factor of optimum as long as the access cost is a convex function. We also study paging, a setting in which the access cost is not convex. The paging rule corresponding to move-to-front is the “least recently used” (LRU) replacement rule. We analyze the amortized complexity of LRU, showing that its efficiency differs from that of the off-line paging rule (Belady's MIN algorithm) by a factor that depends on the size of fast memory. No on-line paging algorithm has better amortized performance.",Robert E. Tarjan,1007
53,1052,H. M. Gladney,Data replicas in distributed information services,1989,"In an information distribution network in which records are repeatedly read, it is cost-effective to keep read-only copies in work locations. This paper presents a method of updating replicas that need not be immediately synchronized with the source data or with each other. The method allows an arbitrary mapping from source records to replica records. It is fail-safe, maximizes workstation autonomy, and is well suited to a network with slow, unreliable, and/or expensive communications links.The algorithm is a manipulation of queries, which are represented as short encodings. When a response is generated, we record which portion of the source database was used. Later, when the source data are updated, this information is used to identify obsolete replicas. For each workstation, the identity of obsolete replicas is saved until a workstation process asks for this information. This workstation process deletes each obsolete replica, and replaces it by an up-to-date version either promptly or the next time the application asks for this particular item. Throughout, queries are grouped so that the impact of each source update transaction takes effect atomically at each workstation.Optimizations of the basic algorithm are outlined. These overlap change dissemination with user service, allow the mechanism to be hidden within the data delivery subsystem, and permit very large networks.",H. M. Gladney,1052
54,1053,M. Girault,A generalized birthday attack,1988,"We generalize the birthday attack presented by Coppersmith at Crypto'85 which defrauded a Davies-Price message authentication scheme. We first study the birthday paradox and a variant for which some convergence results and related bounds are provided. Secondly, we generalize the Davies-Price scheme and show how the Coppersmith attack can be extended to this case. As a consequence, the case p=4 with DES (important when RSA with a 512-bit modulus is used for signature) appears not to be secure enough.",M. Girault,1053
