user_id,author_id,author,title,year,abstract,co_author,coauthor_id
1,1000,Wolfgang Bibel,The role of logic for data and knowledge bases: a brief survey,1989,"When two or more distinct organizations interconnect their internal computer networks they form an Inter-Organization Network(ION). IONs support the exchange of cad/cam data between manufacturers and subcontractors, software distribution from vendors to users, customer input to suppliers' order-entry systems, and the shared use of expensive computational resources by research laboratories, as examples. This paper analyzes the technical implications of interconnecting networks across organization boundaries.After analyzing the organization context in which IONs are used, we demonstrate that such interconnections are not satisfied by traditional network design criteria of connectivity and transparency. To the contrary, a primary high-level requirement is access control, and participating organizations must be able to limit connectivity and make network boundaries visible. We describe a scheme based on non-discretionary control which allows interconnecting organizations to combine gateway, network, and system-level mechanisms to enforce cross-boundary control over invocation and information flow, while minimizing interference with internal operations.Access control requirements such as these impose new requirements on the underlying interconnection protocols. We demonstrate such alternative interconnection protocols that support loose coupling across administrative boundaries and that accommodate the necessary control mechanisms. Message-based gateways that support non-real-time invocation of services (e.g., file and print servers, financial transactions, VLSI design tools, etc.) are a promising basis for such loose couplings.",Jean-Marie Nicolas,1001
2,1001,Jean-Marie Nicolas,How to look at deductive databases,1989,"Hosts are under EMCON condition, short for Emission Control, when they are prohibited from transmitting any data. Under such condition, hosts can only receive data passively and can not acknowledge any data reception. This unidirectionality of the communication channel breaks down all currently defined transport protocols. In this paper, we present architectural alternatives that would support limited communication service under such condition and also discuss other open issues.",J. B. Bocca,1005
3,1002,D. Chan,An experiment with programming using pure negation,1989,"In distributed systems surveillance protocols are used for monitoring the status of remote sites. A remote site is regarded as being available as long as messages are received from this site, otherwise it is regarded as being unavailable. If a site becomes unavailable, this will be reported to other sites and recovery actions can be initiated. Using an example it will be shown that in certain cases it is necessary, that whenever some site S1 detects the unavailability of some other site S2, within a fixed amount of time S2 must also have detected an unavailability of S1. Unfortunately, this cannot be guaranteed by existing surveillance protocols. Another problem with existing protocols is, that remote sites are usually reported as being unavailable after being timed out only once, i.e. the loss of just one message might cause complete systems to back out.Two versions of a protocol for so-called symmetric surveillance are presented. Both guarantee, that if S1 detects the unavailability of S2 at time t0, then S2 (provided that S2 has not crashed) will become aware of this fact at t1 such that [t1 - t0]",M. Wallace,1003
4,1003,M. Wallace,Mapping object-oriented concepts into relational concepts by meta-compilation in a logic programming environment,1988,"The Versatile Message Transaction Protocol (VMTP) is a transport-level protocol designed to support remote procedure call, multicast and real-time communication. The protocol is optimized for efficient page-level network file access in particular.In this paper, we describe the significant aspects of the VMTP design, including the VMTP treatment of sessions, addressing, duplicate suppression, flow control and retransmissions plus its provision for multicast. The VMTP design reflects a change in the use of computer communication as well as a change in the underlying hardware base for the next generation of communication systems. It also challenges certain established notions in the design of protocols.",J. C. Freytag,1004
5,1004,J. C. Freytag,Mapping object-oriented concepts into relational concepts by meta-compilation in a logic programming environment,1988,"The paper is concerned with efficient implementation of evolved modular and structured microprogramming. A microprogrammable architecture is presented that permits designing hierarchical complicated modular microprograms at two distinct levels: the global control and the data processing level. The architecture is based on two cooperating microprogram control units that separately store and perform control and executive microinstructions and microcode modules. The control organization of an implementing computer is presented which assures the quasi time-transparency of modular control in microprograms during the microprogram execution. This is achieved by parallel functioning of constituent control units, that permits preparing in advance addresses of executive modules referenced by control microinstructions. The efficient implementation of control statements of high level languages and microprogramming at the assembler language level for the proposed architecture are also discussed in the paper.",J. B. Bocca,1005
6,1005,J. B. Bocca,Rules for implementing very large knowledge base systems,1989,"We apply the verification methodology underlying the S*-System[12], [13] to the verification of a hierarchically structured design [16] of an emulation of the instruction-set of a commercially available computer on a commercially available micro-architecture. Based on this case-study, we discuss some aspects of the relation between verification and generation of microcode.",J. C. Freytag,1004
7,1006,Andrew V. Goldberg,A new approach to the maximum-flow problem,1988,"All previously known efficient maximum-flow algorithms work by finding augmenting paths, either one path at a time (as in the original Ford and Fulkerson algorithm) or all shortest-length augmenting paths at once (using the layered network approach of Dinic). An alternative method based on the preflow concept of Karzanov is introduced. A preflow is like a flow, except that the total amount flowing into a vertex is allowed to exceed the total amount flowing out. The method maintains a preflow in the original network and pushes local flow excess toward the sink along what are estimated to be shortest paths. The algorithm and its analysis are simple and intuitive, yet the algorithm runs as fast as any other known method on dense graphs, achieving an O(n3) time bound on an n-vertex graph. By incorporating the dynamic tree data structure of Sleator and Tarjan, we obtain a version of the algorithm running in O(nm log(n2/m)) time on an n-vertex, m-edge graph. This is as fast as any known method for any graph density and faster on graphs of moderate density. The algorithm also admits efficient distributed and parallel implementations. A parallel implementation running in O(n2log n) time using n processors and O(m) space is obtained. This time bound matches that of the Shiloach-Vishkin algorithm, which also uses n processors but requires O(n2) space.",Robert E. Tarjan,1007
8,1007,Robert E. Tarjan,Erratum: an O (n log log n)-time algorithm for triangulating a simple polygon,1985,"In this article we study the amortized efficiency of the “move-to-front” and similar rules for dynamically maintaining a linear list. Under the assumption that accessing the ith element from the front of the list takes &thgr;(i) time, we show that move-to-front is within a constant factor of optimum among a wide class of list maintenance rules. Other natural heuristics, such as the transpose and frequency count rules, do not share this property. We generalize our results to show that move-to-front is within a constant factor of optimum as long as the access cost is a convex function. We also study paging, a setting in which the access cost is not convex. The paging rule corresponding to move-to-front is the “least recently used” (LRU) replacement rule. We analyze the amortized complexity of LRU, showing that its efficiency differs from that of the off-line paging rule (Belady's MIN algorithm) by a factor that depends on the size of fast memory. No on-line paging algorithm has better amortized performance.",Daniel D. Sleator,1008
9,1008,Daniel D. Sleator,A locally adaptive data compression scheme,1986,"A data compression scheme that exploits locality of reference, such as occurs when words are used frequently over short intervals and then fall into long periods of disuse, is described. The scheme is based on a simple heuristic for self-organizing sequential search and on variable-length encodings of integers. We prove that it never performs much worse than Huffman coding and can perform substantially better; experiments on real files show that its performance is usually quite close to that of Huffman coding. Our scheme has many implementation advantages: it is simple, allows fast encoding and decoding, and requires only one pass over the data to be compressed (static Huffman coding takes two passes).",Wolfgang Bibel,1000
10,1007,Robert E. Tarjan,Planar point location using persistent search trees,1986,"A classical problem in computational geometry is the planar point location problem. This problem calls for preprocessing a polygonal subdivision of the plane defined by n line segments so that, given a sequence of points, the polygon containing each point can be determined quickly on-line. Several ways of solving this problem in O(log n) query time and O(n) space are known, but they are all rather complicated. We propose a simple O(log n)-query-time, O(n)-space solution, using persistent search trees. A persistent search tree differs from an ordinary search tree in that after an insertion or deletion, the old version of the tree can still be accessed. We develop a persistent form of binary search tree that supports insertions and deletions in the present and queries in the past. The time per query or update is O(log m), where m is the total number of updates, and the space needed is O(1) per update. Our planar point location algorithm is an immediate application of this data structure. The structure also provides an alternative to Chazelle's """"hive graph"""" structure, which has a variety of applications in geometric retrieval.",Jean-Marie Nicolas,1001
11,1010,David Laur,Hierarchical splatting: a progressive refinement algorithm for volume rendering,1991,"This paper presents a progressive refinement algorithm for volume rendering which uses a pyramidal volume representation. Besides storing average values, the pyramid stores estimated error, so an octtree can be fit to the pyramid given a user-supplied precision. This octtree is then drawn using a set of splats, or footprints, each scaled to match the size of the projection of a cell. The splats themselves are approximated with RGBA Gouraud-shaded polygons, so that they can be drawn efficiently on modern graphics workstations. The result is a real-time rendering algorithm suitable for interactive applications.",D. Chan,1002
12,1011,Bruce R. Donald,Real-time robot motion planning using rasterizing computer graphics hardware,1990,"We present a real-time robot motion planner that is fast and complete to a resolution. The technique is guaranteed to find a path if one exists at the resolution, and all paths returned are safe. The planner can handle any polyhedral geometry of robot and obstacles, including disjoint and highly concave unions of polyhedra.The planner uses standard graphics hardware to rasterize configuration space obstacles into a series of bitmap slices, and then uses dynamic programming to create a navigation function (a discrete vector-valued function) and to calculate paths in this rasterized space. The motion paths which the planner produces are minimal with respect to an L1 (Manhattan) distance metric that includes rotation as well as translation.Several examples are shown illustrating the competence of the planner at generating planar rotational and translational plans for complex two and three dimensional robots. Dynamic motion sequences, including complicated and non-obvious backtracking solutions, can be executed in real time.",Donald P. Greenberg,1018
13,1012,Françis X. Sillion,A global illumination solution for general reflectance distributions,1991,"A general light transfer simulation algorithm for environments composed of materials with arbitrary reflectance functions is presented. This algorithm removes the previous practical restriction to ideal specular and/or ideal diffuse environments, and supports complex physically based reflectance distributions, This is accomplished by extending previous two-pass ray-casting radiosity approaches to handle non-uniform intensity distributions, and resolving all possible energy transfers between sample points. An implementation is described based on a spherical harmonic decomposition for encoding both bidirectional reflectance distribution functions for materials, and directional intensity distributions for illuminated surfaces. The method compares favorably with experimental measurements.",Donald P. Greenberg,1018
14,1013,Greg Turk,Interactive simulation in a multi-person virtual world,1992,"A multi-user Virtual World has been implemented combining a flexible-object simulator with a multisensory user interface, including hand motion and gestures, speech input and output, sound output, and 3-D stereoscopic graphics with head-motion parallax. The implementation is based on a distributed client/server architecture with a centralized Dialogue Manager. The simulator is inserted into the Virtual World as a server. A discipline for writing interaction dialogues provides a clear conceptual hierarchy and the encapsulation of state. This hierarchy facilitates the creation of alternative interaction scenarios and shared multiuser environment.",Lawrence Koved,1016
15,1007,Robert E. Tarjan,Faster algorithms for the shortest path problem,1990,"Efficient implementations of Dijkstra's shortest path algorithm are investigated. A new data structure, called the radix heap, is proposed for use in this algorithm. On a network with n vertices, m edges, and nonnegative integer arc costs bounded by C, a one-level form of radix heap gives a time bound for Dijkstra's algorithm of O(m + n log C). A two-level form of radix heap gives a bound of O(m + n log C/log log C). A combination of a radix heap and a previously known data structure called a Fibonacci heap gives a bound of O(m + na @@@@log C). The best previously known bounds are O(m + n log n) using Fibonacci heaps alone and O(m log log C) using the priority queue structure of Van Emde Boas et al. [ 17].",Kurt Mehlhorn,1017
16,1015,Michael Kaufmann,The Art Gallery theorem for polygons with holes,1991,"Art gallery problems which have been extensively studied over the last decade ask how to station a small (minimum) set of guards in a polygon such that every point of the polygon is watched by at least one guard. The graph-theoretic formulation and solution to the gallery problem for polygons in standard form is given. A complexity analysis is carried out, and open problems are discussed.",Kurt Mehlhorn,1017
17,1016,Lawrence Koved,Design for interactive performance in a virtual laboratory,1990,"In recent years, a number of research groups have implemented various versions of virtual world concept [2, 4, 6, 7]. A common thread among these virtual worlds is a direct manipulation user interface paradigm based on a glove device with the position and orientation of the hand registered by a tracking device. To explore this paradigm, a new project at IBM Research was started in 1989 to build a virtual laboratory for scientists and engineers. Our first step is to integrate the glove and space tracking devices with the real time graphics on a graphics superworkstation. A simple bouncing ball virtual world has been created to test underlying software and fine tune interactive performance.Our initial emphasis is placed on understanding the limitations of various system components and getting the best interactive performance from the system. With current state of technology, the glove and tracking devices can generate much more data than the graphics update process can utilize. Both the rendering process and the processes handling the device serial ports are CPU intensive. Our first design problem is how to distribute the processing and match the incoming data rates of input devices with the update rate of the graphics. After a new position from the tracker is received by the graphics, it is displayed only at the next frame update time giving the appearance that the hand image always lags behind the motion of the real hand. Our second design problem is to use techniques to compensate for this inherent lag time. This abstract describes the specific approaches we use to solve these problems and some useful insight gained in experimenting with lag time reduction by position prediction.",J. B. Bocca,1005
18,1017,Kurt Mehlhorn,On simultaneous inner and outer approximation of shapes,1990,"For compact Euclidean bodies P, Q, we define &lgr;(P, Q) to be smallest ratio r/s where r 0, s 0 satisfy sQ? ? P ? rQ?. Here sQ denotes a scaling of Q by factor s, and Q?, Q? are some translates of Q. This function &lgr; gives us a new distance function between bodies which, unlike previously studied measures, is invariant under affine transformations. If homothetic bodies are identified, the logarithm of this function is a metric. (Two bodies are homothetic if one can be obtained from the other by scaling and translation).For integer &kgr; ? 3, define &lgr;(&kgr;) to be the minimum value such that for each convex polygon P there exists a convex &kgr;-gon Q with &lgr;(P, Q) ? &lgr;(&kgr;). Among other results, we prove that 2.118… ? &lgr;(3) ? 2.25 and &lgr;(&kgr;) = 1 + &THgr;(&kgr;-2). We give an &Ogr;(n2 log2 n) time algorithm which for any input convex n-gon P, finds a triangle T that minimizes &lgr;(T, P) among triangles. But in linear time, we can find a triangle t with &lgr;(t, P) ? 2.25.Our study is motivated by the attempt to reduce the complexity of the polygon containment problem, and also the motion planning problem. In each case, we describe algorithms which will run faster when certain implicit slackness parameters of the input are bounded away from 1. These algorithms illustrate a new algorithmic paradigm in computational geometry for coping with complexity.",Rudolf Fleischer,1025
19,1018,Donald P. Greenberg,Design and simulation of opera lighting and projection effects,1991,"A major problem challenging opera designers is the inability to co-ordinate lighting, projection systems, and set designs in the preliminary planning phase. New computer graphics techniques, which provide the set and lighting designer the opportunity to evaluate, test, and control opera designs prior to the construction of full scale systems are presented. These techniques---light source input, simulation of directional lighting, modeling of scenic projection systems, and full three-dimensional simulation---show the potential for the use of computer graphics in theater design.The light source input component consists of a program for assigning light source attributes with a set of theater lighting icons. This module allows a designer to specify light source characteristics in a way familiar to the discipline and to make preliminary evaluations of the lighting conditions.An extended progressive radiosity method is introduced to simulate the directional lighting characteristics which are specified by the input program.A new projection approach is presented to simulate the optical effects of scenic projectors. In addition, a solution to the distortion problem produced by angular projections is described.The above components are integrated to produce full three-dimensional simulations of the global illumination effects in an opera scene.",Françis X. Sillion,1012
20,1019,John M. Airey,Towards image realism with interactive update rates in complex virtual building environments,1990,"Two strategies, pre-computation before display and adaptive refinement during display, are used to combine interactivity with high image quality in a virtual building simulation. Pre-computation is used in two ways. The hidden-surface problem is partially solved by automatically pre-computing potentially visible sets of the model for sets of related viewpoints. Rendering only the potentially visible subset associated with the current viewpoint, rather than the entire model, produces significant speedups on real building models. Solutions for the radiosity lighting model are pre-computed for up to twenty different sets of lights. Linear combinations of these solutions can be manipulated in real time. We use adaptive refinement to trade image realism for interactivity as the situation requires. When the user is stationary we replace a coarse model using few polygons with a more detailed model. Image-level linear interpolation smooths the transition between differing levels of image realism.","Frederick P. Brooks, Jr.",1022
21,1007,Robert E. Tarjan,Relaxed heaps: an alternative to Fibonacci heaps with applications to parallel computation,1988,"The relaxed heap is a priority queue data structure that achieves the same amortized time bounds as the Fibonacci heap—a sequence of m decrease_key and n delete_min operations takes time O(m + n log n). A variant of relaxed heaps achieves similar bounds in the worst case—O(1) time for decrease_key and O(log n) for delete_min. Relaxed heaps give a processor-efficient parallel implementation of Dijkstra's shortest path algorithm, and hence other algorithms in network optimization. A relaxed heap is a type of binomial queue that allows heap order to be violated.",D. Chan,1002
22,1021,"Frederick P. Brooks, Jr",Project GROPEHaptic displays for scientific visualization,1990,"We began in 1967 a project to develop a haptic+display for 6-D force fields of interacting protein molecules. We approached it in four stages: a 2-D system, a 3-D system tested with a simple task, a 6-D system tested with a simple task, and a full 6-D molecular docking system, our initial goal. This paper summarizes the entire project---the four systems, the evaluation experiments, the results, and our observations. The molecular docking system results are new.Our principal conclusions are:• Haptic display as an augmentation to visual display can improve perception and understanding both of force fields and of world models populated with impenetrable objects.• Whereas man-machine systems can outperform computer-only systems by orders of magnitude on some problems, haptic-augmented interactive systems seem to give about a two-fold performance improvement over purely graphical interactive systems. Better technology may give somewhat more, but a ten-fold improvement does not seem to be in the cards.• Chemists using GROPE-III can readily reproduce the true docking positions for drugs whose docking is known (but not to them) and can find very good docks for drugs whose true docks are unknown. The present tool promises to yield new chemistry research results; it is being actively used by research chemists.• The most valuable result from using GROPE-III for drug docking is probably the radically improved situation awareness that serious users report. Chemists say they have a new understanding of the details of the receptor site and its force fields, and of why a particular drug docks well or poorly.• We see various scientific/education applications for haptic displays but believe entertainment, not scientific visualization, will drive and pace the technology.• The hardware-software system technology we have used is barely adequate, and our experience sets priorities for future development.• Some unexpected perceptual phenomena were observed. All of these worked for us, not against us.","Frederick P. Brooks, Jr.",1022
23,1022,"Frederick P. Brooks, Jr.",No Silver Bullet Essence and Accidents of Software Engineering,1987,First Page of the Article,"Frederick P. Brooks, Jr.",1022
24,1023,Ware Myers,Software Pivotal to Strategic Defense,1989,"The role of software in the success of the Strategic Defense System, as reflected in the keynote address and papers at the Second International Conference on Software for Strategic Systems, in Huntsville, Alabama, October 26, 1988, is discussed. The dominant theme is that making huge aggregations of weapons work together depends on well-conceived architecture and battle-scale simulation, which takes increased investment in software environments. The issues of software reliability, software engineering environments, simulation, and software productivity are examined. An approach to software engineering called the Ada process model is defined and characterized by a set of guidelines.",Ware Myers,1023
25,1023,Ware Myers,Interactive Computer Graphics,1984,First Page of the Article,Ware Myers,1023
