user_id,author_id,author,title,year,abstract,co_author,coauthor_id
110,1016,Lawrence Koved,Design for interactive performance in a virtual laboratory,1990,"In recent years, a number of research groups have implemented various versions of virtual world concept [2, 4, 6, 7]. A common thread among these virtual worlds is a direct manipulation user interface paradigm based on a glove device with the position and orientation of the hand registered by a tracking device. To explore this paradigm, a new project at IBM Research was started in 1989 to build a virtual laboratory for scientists and engineers. Our first step is to integrate the glove and space tracking devices with the real time graphics on a graphics superworkstation. A simple bouncing ball virtual world has been created to test underlying software and fine tune interactive performance.Our initial emphasis is placed on understanding the limitations of various system components and getting the best interactive performance from the system. With current state of technology, the glove and tracking devices can generate much more data than the graphics update process can utilize. Both the rendering process and the processes handling the device serial ports are CPU intensive. Our first design problem is how to distribute the processing and match the incoming data rates of input devices with the update rate of the graphics. After a new position from the tracker is received by the graphics, it is displayed only at the next frame update time giving the appearance that the hand image always lags behind the motion of the real hand. Our second design problem is to use techniques to compensate for this inherent lag time. This abstract describes the specific approaches we use to solve these problems and some useful insight gained in experimenting with lag time reduction by position prediction.",J. B. Bocca,1005
111,1017,Kurt Mehlhorn,On simultaneous inner and outer approximation of shapes,1990,"For compact Euclidean bodies P, Q, we define &lgr;(P, Q) to be smallest ratio r/s where r 0, s 0 satisfy sQ? ? P ? rQ?. Here sQ denotes a scaling of Q by factor s, and Q?, Q? are some translates of Q. This function &lgr; gives us a new distance function between bodies which, unlike previously studied measures, is invariant under affine transformations. If homothetic bodies are identified, the logarithm of this function is a metric. (Two bodies are homothetic if one can be obtained from the other by scaling and translation).For integer &kgr; ? 3, define &lgr;(&kgr;) to be the minimum value such that for each convex polygon P there exists a convex &kgr;-gon Q with &lgr;(P, Q) ? &lgr;(&kgr;). Among other results, we prove that 2.118… ? &lgr;(3) ? 2.25 and &lgr;(&kgr;) = 1 + &THgr;(&kgr;-2). We give an &Ogr;(n2 log2 n) time algorithm which for any input convex n-gon P, finds a triangle T that minimizes &lgr;(T, P) among triangles. But in linear time, we can find a triangle t with &lgr;(t, P) ? 2.25.Our study is motivated by the attempt to reduce the complexity of the polygon containment problem, and also the motion planning problem. In each case, we describe algorithms which will run faster when certain implicit slackness parameters of the input are bounded away from 1. These algorithms illustrate a new algorithmic paradigm in computational geometry for coping with complexity.",Rudolf Fleischer,1025
112,1019,John M. Airey,Towards image realism with interactive update rates in complex virtual building environments,1990,"Two strategies, pre-computation before display and adaptive refinement during display, are used to combine interactivity with high image quality in a virtual building simulation. Pre-computation is used in two ways. The hidden-surface problem is partially solved by automatically pre-computing potentially visible sets of the model for sets of related viewpoints. Rendering only the potentially visible subset associated with the current viewpoint, rather than the entire model, produces significant speedups on real building models. Solutions for the radiosity lighting model are pre-computed for up to twenty different sets of lights. Linear combinations of these solutions can be manipulated in real time. We use adaptive refinement to trade image realism for interactivity as the situation requires. When the user is stationary we replace a coarse model using few polygons with a more detailed model. Image-level linear interpolation smooths the transition between differing levels of image realism.","Frederick P. Brooks, Jr.",1022
113,1023,Ware Myers,Software Pivotal to Strategic Defense,1989,"The role of software in the success of the Strategic Defense System, as reflected in the keynote address and papers at the Second International Conference on Software for Strategic Systems, in Huntsville, Alabama, October 26, 1988, is discussed. The dominant theme is that making huge aggregations of weapons work together depends on well-conceived architecture and battle-scale simulation, which takes increased investment in software environments. The issues of software reliability, software engineering environments, simulation, and software productivity are examined. An approach to software engineering called the Ada process model is defined and characterized by a set of guidelines.",Ware Myers,1023
114,1026,Robert L. Brown,Advanced Operating Systems,1984,First Page of the Article,Peter J. Denning,1028
115,1029,Barbara Simons,An ACM response: the scope and directions of Computer Science,1991,"The National Research Council's Computer Science and Telecommunications Board (CSTB) chartered a two-year study on the scope and directions of computer science. As part of this study, ACM was asked to provide input on three important questions, the answers to which could have significant impact on the future direction of our discipline and profession.",A. Joe Turner,1093
116,1028,Peter J. Denning,The evolution of parallel processing,1985,"As everyone knows, the computer industry is passing through a period of great change. I was speaking recently to a senior executive in one of the large companies vigorously working to meet the developing situation. The question he posed was: “Could it have been predicted?”",Peter J. Denning,1028
117,1032,Eli Upfal,How to share memory in a distributed system,1987,"The power of shared-memory in models of parallel computation is studied, and a novel distributed data structure that eliminates the need for shared memory without significantly increasing the run time of the parallel computation is described. More specifically, it is shown how a complete network of processors can deterministically simulate one PRAM step in O(log n/(log log n)2) time when both models use n processors and the size of the PRAM's shared memory is polynomial in n. (The best previously known upper bound was the trivial O(n)). It is established that this upper bound is nearly optimal, and it is proved that an on-line simulation of T PRAM steps by a complete network of processors requires &OHgr;(T(log n/ log log n)) time.A simple consequence of the upper bound is that an Ultracomputer (the currently feasible general-purpose parallel machine) can simulate one step of a PRAM (the most convenient parallel model to program) in O((log n)2log log n) steps.",Avi Wigderson,1038
118,1032,Eli Upfal,A tradeoff between space and efficiency for routing tables,1988,"Two conflicting goals play a crucial role in the design of routing schemes for communication networks. A routing scheme should use as short as possible paths for routing messages in the network, while keeping the routing information stored in the processors' local memory as succinct as possible. The efficiency of a routing scheme is measured in terms of its stretch factor - the maximum ratio between the length of a route computed by the scheme and that of a shortest path connecting the same pair of vertices.Most previous work has concentrated on finding good routing schemes (with a small fixed stretch factor) for special classes of network topologies. In this work we study the problem for general networks, and look at the entire range of possible stretch factors. The results exhibit a tradeoff between the efficiency of a routing scheme and its space requirements. We present almost tight upper and lower bounds for this tradeoff. Specifically, we prove that any routing scheme for general n-vertex networks that achieves a stretch factor k ? 1 must use a total of &OHgr;(n1+1/2k+4) bits of routing information in the networks. This lower bound is complemented by a family H(k) of hierarchical routing schemes (for every fixed k ? 1), which guarantee a stretch factor of &Ogr;(k), require storing a total of &Ogr;(n1+1/k) bits of routing information in the network and name the vertices with &Ogr;(log2 n)-bit names.",David Peleg,1040
119,1036,Sampath Kannan,Implicit representation of graphs,1988,"How to represent a graph in memory is a fundamental data structuring question. In the usual representations of an n-node graph, the names of the nodes (i.e. integers from 1 to n) betray nothing about the graph itself. Indeed, the names (or labels) on the n nodes are just logn bit place holders to allow data on the edges to code for the structure of the graph. In our scenario, there is no such waste. By assigning &Ogr;(logn) bit labels to the nodes, we completely code for the structure of the graph, so that given the labels of two nodes we can test if they are adjacent in time linear in the size of the labels. Furthermore, given an arbitrary original labeling of the nodes, we can find structure coding labels (as above) that are no more than a small constant factor larger than the original labels. These notions are intimately related to vertex induced universal graphs of polynomial size. For example, we can label planar graphs with structure coding labels of size n. This implies the existence of a graph with n4 nodes that contains all n-node planar graphs as vertex induced subgraphs (It was not previously known that this class had polynomial sized universal graphs). The theorems on finite graphs extend to a theorem about the constrained labeling of infinite graphs.",Moni Naor,1076
120,1037,Manuel Blum,Non-interactive zero-knowledge and its applications,1988,"We show that interaction in any zero-knowledge proof can be replaced by sharing a common, short, random string. We use this result to construct the first public-key cryptosystem secure against chosen ciphertext attack.",Paul Feldman,1043
121,1038,Avi Wigderson,A fast parallel algorithm for the maximal independent set problem,1985,"A parallel algorithm is presented that accepts as input a graph G and produces a maximal independent set of vertices in G. On a P-RAM without the concurrent write or concurrent read features, the algorithm executes in O((log n)4) time and uses O((n/(log n))3) processors, where n is the number of vertices in G. The algorithm has several novel features that may find other applications. These include the use of balanced incomplete block designs to replace random sampling by deterministic sampling, and the use of a “dynamic pigeonhole principle” that generalizes the conventional pigeonhole principle.",Richard M. Karp,1094
122,1041,Srinivas Devadas,Verification of interacting sequential circuits,1991,"The problem of verifying the equivalence of interacting finite state machines (FSMs) described at the logic level is addressed. The problem is formulated as that of checking for the equivalence of the reset/starting states of the two FSMs. First, separate sum-of-product representations of the ON-sets and OFF-sets of each of the flip-flop inputs and primary outputs of the sequential circuit, are extracted using the PODEM algorithm. We describe a fast algorithm for state differentiation based on this representation. The input as well as the state space is implicitly enumerated through a process of repeated cube intersections to generate the State Transition Graph (STG).In contrast to previous approaches, this algorithm can be efficiently generalized for verifying distributed-style specifications of interacting sequential circuits, exploiting the nature of the interconnection topology. Pipeline latches in a distributed-style specification typically do not add complexity to the sequential behavior of a circuit, but greatly add to the complexity of traditional approaches to verifying sequential circuits. Pipeline latches are easily incorporated into our generalized, hierarchical verification strategy whereby the states of pipeline latches can be implicitly enumerated.Experimental results indicate the superior efficiency of this approach as compared to previous approaches for FSM verification. It is possible to verify examples with more than 1050 states.",David Peleg,1040
123,1043,Paul Feldman,Non-interactive zero-knowledge and its applications,1988,"We show that interaction in any zero-knowledge proof can be replaced by sharing a common, short, random string. We use this result to construct the first public-key cryptosystem secure against chosen ciphertext attack.",Paul Feldman,1043
124,1044,Abdul A. Malik,Reduced offsets for two-level multi-valued logic minimization,1991,"The approaches to two-level logic minimization can be classified into two groups: those that use tautology for expansion of cubes and those that use the offset. Tautology based schemes are generally slower and often give somewhat inferior results, because of a limited global picture of the way in which the cube can be expanded. If the offset is used, usually the expansion can be done quickly and in a more global way because it is easier to see effective directions of expansion. The problem with this approach is that there are many functions that have a reasonable size onset and don't care set but the offset is unreasonably large. It was recently shown that for the minimization of such Boolean functions, a new approach using reduced offsets, provides the same global picture and can be computed much faster. In this paper we extend reduced offsets to logic functions with multi-valued inputs.",A. Richard Newton,1046
125,1041,Srinivas Devadas,Verification of interacting sequential circuits,1991,"The problem of verifying the equivalence of interacting finite state machines (FSMs) described at the logic level is addressed. The problem is formulated as that of checking for the equivalence of the reset/starting states of the two FSMs. First, separate sum-of-product representations of the ON-sets and OFF-sets of each of the flip-flop inputs and primary outputs of the sequential circuit, are extracted using the PODEM algorithm. We describe a fast algorithm for state differentiation based on this representation. The input as well as the state space is implicitly enumerated through a process of repeated cube intersections to generate the State Transition Graph (STG).In contrast to previous approaches, this algorithm can be efficiently generalized for verifying distributed-style specifications of interacting sequential circuits, exploiting the nature of the interconnection topology. Pipeline latches in a distributed-style specification typically do not add complexity to the sequential behavior of a circuit, but greatly add to the complexity of traditional approaches to verifying sequential circuits. Pipeline latches are easily incorporated into our generalized, hierarchical verification strategy whereby the states of pipeline latches can be implicitly enumerated.Experimental results indicate the superior efficiency of this approach as compared to previous approaches for FSM verification. It is possible to verify examples with more than 1050 states.",Paul Feldman,1043
126,1049,Alberto Sangiovanni-Vincentelli,Computer architecture issues in circuit simulation,1988,"The computational complexity of approximating omega (G), the size of the largest clique in a graph G, within a given factor is considered. It is shown that if certain approximation procedures exist, then EXPTIME=NEXPTIME and NP=P.",Alberto Sangiovanni-Vincentelli,1049
127,1050,J. C. van Vliet,An evaluation of tagging,1985,"Tag handling accounts for a substantial amount of execution cost in latently typed languages such as Common LISP and Scheme, espicially on architectures that provide no special hardware support.",H. M. Gladney,1052
128,1052,H. M. Gladney,Data replicas in distributed information services,1989,"In an information distribution network in which records are repeatedly read, it is cost-effective to keep read-only copies in work locations. This paper presents a method of updating replicas that need not be immediately synchronized with the source data or with each other. The method allows an arbitrary mapping from source records to replica records. It is fail-safe, maximizes workstation autonomy, and is well suited to a network with slow, unreliable, and/or expensive communications links.The algorithm is a manipulation of queries, which are represented as short encodings. When a response is generated, we record which portion of the source database was used. Later, when the source data are updated, this information is used to identify obsolete replicas. For each workstation, the identity of obsolete replicas is saved until a workstation process asks for this information. This workstation process deletes each obsolete replica, and replaces it by an up-to-date version either promptly or the next time the application asks for this particular item. Throughout, queries are grouped so that the impact of each source update transaction takes effect atomically at each workstation.Optimizations of the basic algorithm are outlined. These overlap change dissemination with user service, allow the mechanism to be hidden within the data delivery subsystem, and permit very large networks.",H. M. Gladney,1052
129,1053,M. Girault,A generalized birthday attack,1988,"We generalize the birthday attack presented by Coppersmith at Crypto'85 which defrauded a Davies-Price message authentication scheme. We first study the birthday paradox and a variant for which some convergence results and related bounds are provided. Secondly, we generalize the Davies-Price scheme and show how the Coppersmith attack can be extended to this case. As a consequence, the case p=4 with DES (important when RSA with a 512-bit modulus is used for signature) appears not to be secure enough.",M. Girault,1053
130,1057,Mariano P. Consens,The G+/GraphLog Visual Query System,1990,"The video presentation “The G+/GraphLog Visual Query System” gives an overview of the capabilities of the ongoing implementation of the G+ Visual Query System for visualizing both data and queries as graphs. The system provides an environment for expressing queries in GraphLog [Con89, CM89, CM90], as well as for browsing, displaying and editing graphs. The visual query system also supports displaying the answers in several different ways.Graphs are a very natural representation for data in many application domains, for example, transportation networks, project scheduling, parts hierarchies, family trees, concept hierarchies, and Hypertext. From a broader perspective, many databases can be naturally viewed as graphs. In particular, any relational database in which we can identify one or more sets of objects of interest and relationships between them can be represented by mapping these objects into nodes and relationships into edges. In the case of semantic and object-oriented databases, there is a natural mapping of objects to nodes and attributes to edges.GraphLog is a visual query language, based on a graph representation of both data and queries, that has evolved from the earlier language G+ [CMW87, CMW89, MW89]. GraphLog queries ask for patterns that must be present or absent in the database graph. Each such pattern, called a query graph, defines new edges that are added to the graph whenever the pattern is found. GraphLog queries are sets of query graphs, called graphical queries. If, when looking at a query graph in a graphical query, we do not find an edge label in the database, then there must exist another query graph in the graphical query defining that edge. The language also supports computing aggregate functions and summarizing along paths.The G+ Visual Query System is currently implemented in Smalltalk-80™, and runs on Sun 3, Sun 4 and Macintosh II workstations. A Graph Editor is available for editing query graphs and displaying database graphs. It supports graph “cutting and pasting”, as well as text editing of node and edge labels, node and edge repositioning and re-shaping, storage and retrieval of graphs as text files, etc. Automatic graph layout is also provided. For editing collections of graphs (such as graphical queries) a Graph Browser is available.The first answer mode supported by the G+ Visual Query System is to return as the result of a GraphLog query a graph with the new edges defined by the graphical query added to the database graph.An alternative way of visualizing answers is by high-lighting on the database graph, one at a time, the paths (or just the nodes) described by the query. This mode is particularly useful to locate interesting starting points for browsing.Rather than viewing the answers superimposed on the database graph, the user may choose to view them in a Graph Browser. The Graph Browser contains the set of subgraphs of the database graph that were found to satisfy the query.Finally, the user may select to collect all the subgraphs of the database graph that satisfy the query together into one new graph. This graph (as well as any other result graph from any of the above mentioned answer modes) in turn may be queried, providing a mechanism for iterative filtering of irrelevant information until a manageable subgraph is obtained.",Alberto O. Mendelzon,1059
131,1057,Mariano P. Consens,Low complexity aggregation in GraphLog and Datalog,1990,"We present facilities for computing aggregate functions over sets of tuples and along paths in a database graph.We show how Datalog can be extended to compute a large class of queries with aggregates without incurring the large expense of a language with general set manipulation capabilities. In particular, we aim for queries that can be executed efficiently in parallel, using the class NC and its various subclasses as formal models of low parallel complexity.Our approach retains the standard relational notion of relations as sets of tuples, not requiring the introduction of multisets. For the case where no rules are recursive, the language is exactly as expressive as Klug's first order language with aggregates. We show that this class of non-recursive programs cannot express transitive closure (unless LOGSPACE=NLOGSPACE), thus providing evidence for a widely believed but never proven folk result. We also study the expressive power and complexity of languages that support aggregation over recursion.We then describe how these facilities, as well as manipulating the length of paths in database graphs, are incorporated into our visual query language GraphLog. While GraphLog could easily be extended to handle all the queries described above, we prefer to restrict the language in a natural way to avoid explicit recursion; all recursion is expressed as transitive closure. We show that this guarantees all expressible queries are in NC. We analyze other proposals and show that they can express queries that are logspace-complete for P and thus unlikely to be parallelizable efficiently.",Mariano P. Consens,1057
132,1059,Alberto O. Mendelzon,Answering queries on embedded-complete database schemes,1987,"It has been observed that, for some database schemes, users may have difficulties retrieving correct information, even for simple queries. The problem occurs when some implicit “piece” of information, defined on some subset of a relation scheme, is not explicitly represented in the database state. In this situation, users may be required to know how the state and the constraints interact before they can retrieve the information correctly.In this paper, the formal notion of embedded-completeness is proposed, and it is shown that schemes with this property avoid the problem described above. A polynomial-time algorithm is given to test whether a database scheme is independent and embedded-complete. Under the assumption of independence, it is shown that embedded-complete schemes allow efficient computation of optimal relational algebra expressions equivalent to the X-total projection, for any set of attributes X.",M. Wallace,1003
133,1063,Yanjun Zhang,On better heuristic for euclidean Steiner minimum trees (extended abstract),1991,Finding a shortest network interconnecting a given set of points in the Euclidean plane (a Steiner minimum tree) is known to be NP-hard. It is shown that there exists a polynomial-time heuristic with a performance ratio bigger than square root 3/2.,Yanjun Zhang,1063
134,1064,Yonatan Aumann,Asymptotically optimal PRAM emulation on faulty hypercubes (extended abstract),1991,"A scheme for emulating the parallel random access machine (PRAM) on a faulty hypercube is presented. All components of the hypercube, including the memory modules, are assumed to be subject to failure. The faults may occur at any time during the emulation and the system readjusts dynamically. The scheme, which rests on L.G. Valiant's BSP model (1990), is the first to achieve optimal and work-preserving PRAM emulation on a dynamically faulty network.",Michael Ben-Or,1056
