user_id,author_id,author,title,year,abstract,co_author,coauthor_id
55,1054,B. Vallée,How to break Okamoto's cryptosystem by reducing lattice bases,1988,"The security of several signature schemes and cryptosystems, essentially proposed by Okamoto, is based on the difficulty of solving polynomial equations or inequations modulo n. The encryption and the decryption of these schemes are very simple when the factorisation of the modulus, a large composite number, is known.We show here that we can, for any odd n, solve, in polynomial probabilistic time, quadratic equations modulo n, even if the factorisation of n is hidden, provided we are given a sufficiently good approximation of the solutions. We thus deduce how to break Okamoto's second degree cryptosystem and we extend, in this way, Brickell's and Shamir's previous attacks.Our main tool is lattices that we use after a linearisation of the problem, and the success of our method depends on the geometrical regularity of a particular kind of lattices.Our paper is organized as follows: First we recall the problems already posed, their partial solutions and describe how our results solve extensions of these problems. We then introduce our main tool, lattices and show how their geometrical properties fit in our subject. Finally, we deduce our results. These methods can be generalized to higher dimensions.",M. Girault,1053
56,1055,L. C. Guillou,A practical zero-knowledge protocol fitted to security microprocessor minimizing both transmission and memory,1988,"Zero-knowledge interactive proofs are very promising for the problems related to the verification of identity. After their (mainly theoretical) introduction by S. Goldwasser, S. Micali and C. Rackoff (1985), A. Fiat and A. Shamir (1986) proposed a first practical solution: the scheme of Fiat-Shamir is a trade-off between the number of authentication numbers stored in each security microprocessor and the number of witness numbers to be checked at each verification.This paper proposes a new scheme which requires the storage of only one authentication number in each security microprocessor and the check of only one witness number. The needed computations are only 2 or 3 more than for the scheme of Fiat-Shamir.",Wolfgang Bibel,1000
57,1056,Michael Ben-Or,Efficient identification schemes using two prover interactive proofs,1989,"We present two efficient identification schemes based on the difficulty of solving the subset sum problem and the circuit satisfiability problem. Both schemes use the two prover model introduced by [BGKW], where the verifier (e.g the Bank) interacts with two untrusted provers (e.g two bank identification cards) who have jointly agreed on a strategy to convince the verifier of their identity. To believe the validity of their identity proving procedure, the verifier must make sure that the two provers can not communicate with each other during the course of the proof process. In addition to the simplicity and efficiency of the schemes, the resulting two prover interactive proofs can be shown to be perfect zero knowledge, making no intractability assumptions.",Shafi Goldwasser,1068
58,1057,Mariano P. Consens,The G+/GraphLog Visual Query System,1990,"The video presentation “The G+/GraphLog Visual Query System” gives an overview of the capabilities of the ongoing implementation of the G+ Visual Query System for visualizing both data and queries as graphs. The system provides an environment for expressing queries in GraphLog [Con89, CM89, CM90], as well as for browsing, displaying and editing graphs. The visual query system also supports displaying the answers in several different ways.Graphs are a very natural representation for data in many application domains, for example, transportation networks, project scheduling, parts hierarchies, family trees, concept hierarchies, and Hypertext. From a broader perspective, many databases can be naturally viewed as graphs. In particular, any relational database in which we can identify one or more sets of objects of interest and relationships between them can be represented by mapping these objects into nodes and relationships into edges. In the case of semantic and object-oriented databases, there is a natural mapping of objects to nodes and attributes to edges.GraphLog is a visual query language, based on a graph representation of both data and queries, that has evolved from the earlier language G+ [CMW87, CMW89, MW89]. GraphLog queries ask for patterns that must be present or absent in the database graph. Each such pattern, called a query graph, defines new edges that are added to the graph whenever the pattern is found. GraphLog queries are sets of query graphs, called graphical queries. If, when looking at a query graph in a graphical query, we do not find an edge label in the database, then there must exist another query graph in the graphical query defining that edge. The language also supports computing aggregate functions and summarizing along paths.The G+ Visual Query System is currently implemented in Smalltalk-80™, and runs on Sun 3, Sun 4 and Macintosh II workstations. A Graph Editor is available for editing query graphs and displaying database graphs. It supports graph “cutting and pasting”, as well as text editing of node and edge labels, node and edge repositioning and re-shaping, storage and retrieval of graphs as text files, etc. Automatic graph layout is also provided. For editing collections of graphs (such as graphical queries) a Graph Browser is available.The first answer mode supported by the G+ Visual Query System is to return as the result of a GraphLog query a graph with the new edges defined by the graphical query added to the database graph.An alternative way of visualizing answers is by high-lighting on the database graph, one at a time, the paths (or just the nodes) described by the query. This mode is particularly useful to locate interesting starting points for browsing.Rather than viewing the answers superimposed on the database graph, the user may choose to view them in a Graph Browser. The Graph Browser contains the set of subgraphs of the database graph that were found to satisfy the query.Finally, the user may select to collect all the subgraphs of the database graph that satisfy the query together into one new graph. This graph (as well as any other result graph from any of the above mentioned answer modes) in turn may be queried, providing a mechanism for iterative filtering of irrelevant information until a manageable subgraph is obtained.",Alberto O. Mendelzon,1059
59,1057,Mariano P. Consens,Low complexity aggregation in GraphLog and Datalog,1990,"We present facilities for computing aggregate functions over sets of tuples and along paths in a database graph.We show how Datalog can be extended to compute a large class of queries with aggregates without incurring the large expense of a language with general set manipulation capabilities. In particular, we aim for queries that can be executed efficiently in parallel, using the class NC and its various subclasses as formal models of low parallel complexity.Our approach retains the standard relational notion of relations as sets of tuples, not requiring the introduction of multisets. For the case where no rules are recursive, the language is exactly as expressive as Klug's first order language with aggregates. We show that this class of non-recursive programs cannot express transitive closure (unless LOGSPACE=NLOGSPACE), thus providing evidence for a widely believed but never proven folk result. We also study the expressive power and complexity of languages that support aggregation over recursion.We then describe how these facilities, as well as manipulating the length of paths in database graphs, are incorporated into our visual query language GraphLog. While GraphLog could easily be extended to handle all the queries described above, we prefer to restrict the language in a natural way to avoid explicit recursion; all recursion is expressed as transitive closure. We show that this guarantees all expressible queries are in NC. We analyze other proposals and show that they can express queries that are logspace-complete for P and thus unlikely to be parallelizable efficiently.",Mariano P. Consens,1057
60,1059,Alberto O. Mendelzon,Answering queries on embedded-complete database schemes,1987,"It has been observed that, for some database schemes, users may have difficulties retrieving correct information, even for simple queries. The problem occurs when some implicit “piece” of information, defined on some subset of a relation scheme, is not explicitly represented in the database state. In this situation, users may be required to know how the state and the constraints interact before they can retrieve the information correctly.In this paper, the formal notion of embedded-completeness is proposed, and it is shown that schemes with this property avoid the problem described above. A polynomial-time algorithm is given to test whether a database scheme is independent and embedded-complete. Under the assumption of independence, it is shown that embedded-complete schemes allow efficient computation of optimal relational algebra expressions equivalent to the X-total projection, for any set of attributes X.",M. Wallace,1003
61,1027,Karen A. Frenkel,Complexity and parallel processing: an interview with Richard Karp,1986,"In the following interview, which took place at ACM 85 in Denver, Karp discusses the relation of his work to leading-edge computing topics like parallel processing and artificial intelligence. Tracing his experience as a pioneer in highly theoretical computer science, Karp describes how the decision to go against established wisdom led to the work for which he is best known and how a colleague's findings led him to see links between two previously unrelated areas. Throughout, he stresses the exchange of ideas with colleagues that helped yield fundamental insights.",Richard Karp,1062
62,1061,Isabel F. Cruz,DOODLE: a visual language for object-oriented databases,1992,"In this paper we introduce DOODLE, a new visual and declarative language for object-oriented databases. The main principle behind the language is that it is possible to display and query the database with arbitrary pictures. We allow the user to tailor the display of the data to suit the application at hand or her preferences. We want the user-defined visualizations to be stored in the database, and the language to express all kinds of visual manipulations. For extendibility reasons, the language is object-oriented. The semantics of the language is given by a well-known deductive query language for object-oriented databases. We hope that the formal basis of our language will contribute to the theoretical study of database visualizations and visual query languages, a subject that we believe is of great interest, but largely left unexplored.",Isabel F. Cruz,1061
63,1062,Richard Karp,A randomized parallel branch-and-bound procedure,1988,"We present a universal randomized method called Local Best-First Search for parallelizing sequential branch-and-bound algorithms. The method executes on a message-passing multiprocessor system, and requires no global data structures or complex communication protocols. We show that, uniformly on all instances, the execution time of the method is unlikely to exceed a certain inherent lower bound by more than a constant factor.",Yanjun Zhang,1063
64,1063,Yanjun Zhang,On better heuristic for euclidean Steiner minimum trees (extended abstract),1991,Finding a shortest network interconnecting a given set of points in the Euclidean plane (a Steiner minimum tree) is known to be NP-hard. It is shown that there exists a polynomial-time heuristic with a performance ratio bigger than square root 3/2.,Yanjun Zhang,1063
65,1064,Yonatan Aumann,Asymptotically optimal PRAM emulation on faulty hypercubes (extended abstract),1991,"A scheme for emulating the parallel random access machine (PRAM) on a faulty hypercube is presented. All components of the hypercube, including the memory modules, are assumed to be subject to failure. The faults may occur at any time during the emulation and the system readjusts dynamically. The scheme, which rests on L.G. Valiant's BSP model (1990), is the first to achieve optimal and work-preserving PRAM emulation on a dynamically faulty network.",Michael Ben-Or,1056
66,1056,Michael Ben-Or,Completeness theorems for non-cryptographic fault-tolerant distributed computation,1988,"Every function of n inputs can be efficiently computed by a complete network of n processors in such a way that:If no faults occur, no set of size t n/2 of players gets any additional information (other than the function value),Even if Byzantine faults are allowed, no set of size t n/3 can either disrupt the computation or get additional information.Furthermore, the above bounds on t are tight!",Shafi Goldwasser,1068
67,1059,Alberto O. Mendelzon,A graphical query language supporting recursion,1987,"We define a language G for querying data represented as a labeled graph G. By considering G as a relation, this graphical query language can be viewed as a relational query language, and its expressive power can be compared to that of other relational query languages. We do not propose G as an alternative to general purpose relational query languages, but rather as a complementary language in which recursive queries are simple to formulate. The user is aided in this formulation by means of a graphical interface. The provision of regular expressions in G allows recursive queries more general than transitive closure to be posed, although the language is not as powerful as those based on function-free Horn clauses. However, we hope to be able to exploit well-known graph algorithms in evaluating recursive queries efficiently, a topic which has received widespread attention recently.",Isabel F. Cruz,1061
68,1064,Yonatan Aumann,Computing with faulty arrays,1992,"We present and O(1) slowdown emulation of a fault-free N x N two dimensional mesh with a slack of O(log N log log N) by a faulty mesh of the same size and slack. All components of the faulty mesh, including the memory modules, are assumed to be subject to failure. The faults may occur at any time during the emulation and the system readjusts dynamically.",Yonatan Aumann,1064
69,1068,Shafi Goldwasser,New paradigms for digital signatures and message authentication based on non-interactive zero knowledge proofs,1989,Using non-interactive zero knowledge proofs we provide a simple new paradigm for digital signing and message authentication secure against adaptive chosen message attack.For digital signatures we require that the non-interactive zero knowledge proofs be publicly verifiable: they should be checkable by anyone rather than directed at a particular verifier. We accordingly show how to implement noninteractive zero knowledge proofs in a network which have the property that anyone in the network can individually check correctness while the proof is zero knowledge to any sufficiently small coalition. This enables us to implement signatures which are history independent.,Mihir Bellare,1071
70,1056,Michael Ben-Or,Multi-prover interactive proofs: how to remove intractability assumptions,1988,"Quite complex cryptographic machinery has been developed based on the assumption that one-way functions exist, yet we know of only a few possible such candidates. It is important at this time to find alternative foundations to the design of secure cryptography. We introduce a new model of generalized interactive proofs as a step in this direction. We prove that all NP languages have perfect zero-knowledge proof-systems in this model, without making any intractability assumptions.The generalized interactive-proof model consists of two computationally unbounded and untrusted provers, rather than one, who jointly agree on a strategy to convince the verifier of the truth of an assertion and then engage in a polynomial number of message exchanges with the verifier in their attempt to do so. To believe the validity of the assertion, the verifier must make sure that the two provers can not communicate with each other during the course of the proof process. Thus, the complexity assumptions made in previous work, have been traded for a physical separation between the two provers.We call this new model the multi-prover interactive-proof model, and examine its properties and applicability to cryptography.",Michael Ben-Or,1056
71,1068,Shafi Goldwasser,Multiparty computation with faulty majority,1989,"We address the problem of performing a multiparty computation when more than half of the processors are cooperating Byzantine faults. We show how to compute any boolean function of n inputs distributively, preserving the privacy of inputs held by nonfaulty processors, and ensuring that faulty processors obtain the function value """"if and only if"""" the nonfaulty processors do. If the nonfaulty processors do not obtain the correct function value, they detect cheating with high probabihty. Our solution is based on a new type of verifiable secret sharing in which the secret is revealed not all at once but in small increments. This slow-revealing process ensures that all processors discover the secret at roughly the same time. Our solution assumes the existence of an oblivious transfer protocol and uses broadcast channels. We do not require that the processors have equal computing power.",Donald Beaver,1072
72,1071,Mihir Bellare,A technique for upper bounding the spectral norm with applications to learning,1992,"We present a general technique to upper bound the spectral norm of an arbitrary function. At the heart of our technique is a theorem which shows how to obtain an upper bound on the spectral norm of a decision tree given the spectral norms of the functions in the nodes of this tree. The theorem applies to trees whose nodes may compute any boolean functions. Applications are to the design of efficient learning algorithms and the construction of small depth threshold circuits (or neural nets). In particular, we present polynomial time algorithms for learning O(log n) clause DNF formulas and various classes of decision trees, all under the uniform distribution with membership queries.",Mihir Bellare,1071
73,1072,Donald Beaver,Multiparty protocols tolerating half faulty processors,1989,"We show that a complete broadcast network of n processors can evaluate any function f(x1,..., xn) at private inputs supplied by each processor, revealing no information other than the result of the function, while tolerating up to t maliciously faulty parties for 2t n. This improves the previous bound of 3t n on the tolerable number of faults [BG W88, CCD88]. We demonstrate a resilient method to multiply secretly shared values without using unproven cryptographic assumptions. The crux of our method is a new, non-cryptographic zero-knowledge technique which extends verifiable secret sharing to allow proofs based on secretly shared values. Under this method, a single party can secretly share values v1,...vm along with another secret w = P(v1,...,vm), where P is any polynomial size circuit; and she can prove to all other parties that w = P(v1,..., vm), without revealing w or any other information. Our protocols allow an exponentially small chance of error, but are provably optimal in their resilience against Byzantine faults. Furthermore, our solutions use operations over exponentially large fields, greatly reducing the amount of interaction necessary for computing natural functions.",Donald Beaver,1072
74,1056,Michael Ben-Or,Efficient identification schemes using two prover interactive proofs,1989,"We present two efficient identification schemes based on the difficulty of solving the subset sum problem and the circuit satisfiability problem. Both schemes use the two prover model introduced by [BGKW], where the verifier (e.g the Bank) interacts with two untrusted provers (e.g two bank identification cards) who have jointly agreed on a strategy to convince the verifier of their identity. To believe the validity of their identity proving procedure, the verifier must make sure that the two provers can not communicate with each other during the course of the proof process. In addition to the simplicity and efficiency of the schemes, the resulting two prover interactive proofs can be shown to be perfect zero knowledge, making no intractability assumptions.",;Shafi Goldwasser,1068
75,1071,Mihir Bellare,Languages that are easier than their proofs,1991,"Languages in NP are presented for which it is harder to prove membership interactively than it is to decide this membership. Similarly, languages where checking is harder than computing membership are presented. Under assumptions about triple-exponential time, incoherent sets in NP are constructed. Without any assumptions, incoherent sets are constructed in DSPACE (n to the log n), yielding the first uncheckable and non-random-self-reducible sets in that space.",Richard Beigel,1075
76,1075,Richard Beigel,When do extra majority gates help?,1992,"Suppose that f is computed by a constant depth circuit with 2m AND-, OR-, and NOT-gates, and m majority-gates. We prove that f is computed by a constant depth circuit with 2mo(1) AND-, OR-, and NOT-gates, and a single majority-gate, which is at the root.One consequence is that if f is computed by and AC0 circuit plus polylog majority-gates, then f is computed by a probabilistic perceptron having polylog order. Another consequence is that if f agrees with the parity function of three-fourths of all inputs, then fcannot be computed by a constant depth circuit with 2no(1) AND-, OR-, and NOT-gates, and no(1) majority-gates.",Richard Beigel,1075
77,1076,Moni Naor,Bit commitment using pseudo-randomness (extended abstract),1989,"We show how a pseudo-random generator can provide a bit commitment protocol. We also analyze the number of bits communicated when parties commit to many bits simultaneously, and show that the assumption of the existence of pseudorandom generators suffices to assure amortized O(1) bits of communication per bit commitment.",Moni Naor,1076
78,1077,Amos Fiat,Storing and searching a multikey table,1988,"We describe an implicit data structure for n multikey records that supports searching for a record, under any key, in the asymptotically optimal search time &Ogr;(log n). This improves on [Mun87] in which Munro describes an implicit data structure for the problem of storing n k-key records so that search on any key can be performed in &Ogr;(logk n(log log n)k-1) comparisons. The theoretical tools we develop also yield practical schemes that either halve the number of memory references over obvious solutions to the non-implicit version of the problem, or alternatively reduce the number of pointers involved significantly.",Moni Naor,1076
79,1076,Moni Naor,Amortized communication complexity (Preliminary version),1991,"The authors study the direct sum problem with respect to communication complexity: Consider a function f: D to (0, 1), where D contained in (0, 1)/sup n/*(0, 1)/sup n/. The amortized communication complexity of f, i.e. the communication complexity of simultaneously computing f on l instances, divided by l is studied. The authors present, both in the deterministic and the randomized model, functions with communication complexity Theta (log n) and amortized communication complexity O(1). They also give a general lower bound on the amortized communication complexity of any function f in terms of its communication complexity C(f).",Moni Naor,1076
80,1079,Eyal Kushilevitz,Randomized mutual exclusion algorithms revisited,1992,"In [4] a randomized algorithm for mutual exclusion with bounded waiting, employing a logarithmic sized shared variable, was given. Saias and Lynch [5] pointed out that the adversary scheduler postulated in the above paper can observe the behavior of processes in the interval between an opening of the critical section and the next closing of the critical section. it can then draw conclusions about values of their local variables as well as the value of the randomized round number component of the shared variable, and arrange the schedule so as to discriminate against a chosen process. This invalidates the claimed properties of the algorithm.In the present paper the algorithm in [4] is modified, using the ideas of [4], so as to overcome this difficulty, obtaining essentially the same results. Thus, as in [4], randomization yields simple algorithms for mutual-exclusion with bounded waiting, employing a shared variable of considerably smaller size than the lower-bound established in [1] for deterministic algorithms.",Michael O. Rabin,1080
81,1080,Michael O. Rabin,"Efficient dispersal of information for security, load balancing, and fault tolerance",1989,"An Information Dispersal Algorithm (IDA) is developed that breaks a file F of length L = &uharl; F&uharr; into n pieces Fi, l ? i ? n, each of length &uharl;Fi&uharr; = L/m, so that every m pieces suffice for reconstructing F. Dispersal and reconstruction are computationally efficient. The sum of the lengths &uharl;Fi&uharr; is (n/m) · L. Since n/m can be chosen to be close to l, the IDA is space efficient. IDA has numerous applications to secure and reliable storage of information in computer networks and even on single disks, to fault-tolerant and efficient transmission of information in networks, and to communications between processors in parallel computers. For the latter problem provably time-efficient and highly fault-tolerant routing on the n-cube is achieved, using just constant size buffers.",Michael O. Rabin,1080
